{
  "document_type": "letter",
  "locale": "zh-CN",
  "meta": {
    "title": "关于产品架构调整的说明",
    "subtitle": "致全体技术团队成员",
    "eyebrow": "Momo Paper / letter / zh-CN",
    "date": "2025-04-28",
    "sender": "CTO 办公室",
    "recipient": "全体技术团队"
  },
  "sections": {
    "opening": {
      "body": [
        "各位同事：",
        "随着公司业务的快速发展，我们的技术架构面临新的挑战。为了支撑未来 3 年的增长目标，经管理层研究决定，对产品技术架构进行系统性调整。"
      ]
    },
    "body": {
      "paragraphs": [
        "过去两年，我们的单体应用成功支撑了业务从 0 到 1 的突破。但随着用户量突破 500 万，系统瓶颈日益明显。主要问题包括：发布周期长（平均 2 周）、故障影响面大、团队协作效率下降。",
        "为此，我们决定启动「云舟计划」——将核心系统拆分为 8 个微服务，引入容器化部署和 DevOps 流水线。预计转型期为 6 个月，期间将确保业务连续性。",
        "具体安排如下：第一阶段（5-6 月）完成服务拆分设计；第二阶段（7-8 月）核心服务迁移；第三阶段（9-10 月）全量切换与优化。"
      ]
    },
    "request": {
      "body": [
        "此次架构调整需要每位同事的支持与配合。"
      ],
      "actions": [
        "各团队负责人请于 5 月 10 日前提交服务拆分方案初稿",
        "全体后端工程师须参加 5 月 15 日的 Kubernetes 培训",
        "QA 团队需配合制定新的自动化测试策略"
      ]
    },
    "signoff": {
      "closing": "期待与大家共同推动这次重要的技术升级。",
      "name": "张明远",
      "title": "首席技术官"
    }
  }
}
