{
  "document_type": "letter",
  "locale": "zh-CN",
  "meta": {
    "title": "推荐信：高级产品设计师职位",
    "subtitle": "",
    "eyebrow": "Momo Paper / letter / zh-CN",
    "date": "2026-05-02",
    "sender": "张明远 · 产品副总裁",
    "recipient": "招聘委员会 · 创新科技有限公司"
  },
  "sections": {
    "opening": {
      "body": [
        "我谨代表产品团队，强烈推荐李明华女士应聘贵司高级产品设计师职位。我在过去三年中直接管理李明华，对她的专业能力和职业素养有深入了解。",
        "李明华于 2023 年加入我司，从初级设计师成长为团队核心成员。她主导了多款核心产品的设计改版，直接推动了用户满意度和商业指标的显著提升。"
      ]
    },
    "body": {
      "paragraphs": [
        "在设计能力方面，李明华对复杂系统的信息架构有深刻理解。她主导的「设计令牌系统」重构项目，将设计组件的复用率从 35% 提升至 78%，使产品迭代周期缩短了 40%。她在项目中展现出的系统思维和跨团队协作能力令人印象深刻。",
        "李明华还展现出优秀的用户研究能力。她发起的「用户之声」计划，建立了每月深度访谈 12 位用户的常态化机制。这项计划直接催生了 3 个重要的产品改进方向，其中包括被全公司评为年度最佳功能的「智能搜索 2.0」。",
        "在团队贡献方面，李明华积极推动设计评审文化和内部知识分享。她组织了 20+ 场设计分享会，建立了团队的设计模式库，并主动 mentor 了 3 位新入职的初级设计师。她的离开将是团队的重大损失，但我深信她已准备好迎接更大的挑战。",
        "综上所述，李明华是一位兼具设计深度、产品思维和领导潜力的杰出设计师。我对她的未来发展充满信心，毫无保留地推荐她加入贵司。如需进一步了解，欢迎随时联系我。"
      ]
    },
    "signoff": {
      "closing": "此致",
      "name": "张明远",
      "title": "产品副总裁 · 创新科技有限公司"
    }
  }
}
